{
  "schema_version": "1.0",
  "ranking_source": "https://cosign.co/questions/highest-taste-companies",
  "ranking_checked_date": "2026-10-14",
  "entries": [
    {
      "id": "apple",
      "name": "Apple",
      "rank": 1,
      "source_url": "https://www.apple.com/",
      "captured_at": "2026-09-24T14:14:29.940321Z",
      "page_type": "Homepage",
      "use_cases": [
        "hardware"
      ],
      "styles": [
        "cinematic",
        "monochrome",
        "image-led"
      ],
      "quality": "extracted_unverified",
      "warnings": [
        "Sections without data: brand_assets."
      ],
      "selection_note": "Study product-image scale and alternating backgrounds to separate launches.",
      "note_basis": "Editorial inference from TasteLabs extraction; not visually verified.",
      "paths": {
        "profile": "profiles/apple.md",
        "tokens": "data/tokens/apple.json",
        "raw": "data/raw/apple.json"
      }
    },
    {
      "id": "notion",
      "name": "Notion",
      "rank": 2,
      "source_url": "https://www.notion.com/",
      "captured_at": "2026-10-08T00:42:08.521274Z",
      "page_type": "Homepage",
      "use_cases": [
        "productivity"
      ],
      "styles": [
        "warm-editorial",
        "modular"
      ],
      "quality": "extracted_unverified",
      "warnings": [],
      "selection_note": "Pair product screenshots with illustrations to explain tasks without filling the page with controls.",
      "note_basis": "Editorial inference from TasteLabs extraction; not visually verified.",
      "paths": {
        "profile": "profiles/notion.md",
        "tokens": "data/tokens/notion.json",
        "raw": "data/raw/notion.json"
      }
    },
    {
      "id": "linear",
      "name": "Linear",
      "rank": 3,
      "source_url": "https://linear.app/",
      "captured_at": "2026-10-10T10:50:53.682721Z",
      "page_type": "Homepage",
      "use_cases": [
        "developer-tools",
        "productivity"
      ],
      "styles": [
        "dark-technical",
        "modular"
      ],
      "quality": "extracted_unverified",
      "warnings": [],
      "selection_note": "Organize tool demonstrations with dark panels, fine borders, and clear type hierarchy.",
      "note_basis": "Editorial inference from TasteLabs extraction; not visually verified.",
      "paths": {
        "profile": "profiles/linear.md",
        "tokens": "data/tokens/linear.json",
        "raw": "data/raw/linear.json"
      }
    },
    {
      "id": "a24",
      "name": "A24",
      "rank": 4,
      "source_url": "https://a24films.com/",
      "captured_at": "2026-10-14T05:05:03.673018Z",
      "page_type": "Homepage",
      "use_cases": [
        "media-discovery",
        "editorial-research"
      ],
      "styles": [
        "monochrome",
        "image-led"
      ],
      "quality": "extracted_unverified",
      "warnings": [],
      "selection_note": "Give film images space within an editorial structure that uses little interface color.",
      "note_basis": "Editorial inference from TasteLabs extraction; not visually verified.",
      "paths": {
        "profile": "profiles/a24.md",
        "tokens": "data/tokens/a24.json",
        "raw": "data/raw/a24.json"
      }
    },
    {
      "id": "teenage-engineering",
      "name": "teenage engineering",
      "rank": 5,
      "source_url": "https://teenage.engineering/",
      "captured_at": "2026-09-19T08:37:42.947619Z",
      "page_type": "Homepage",
      "use_cases": [
        "hardware"
      ],
      "styles": [
        "monochrome",
        "image-led",
        "modular"
      ],
      "quality": "extracted_unverified",
      "warnings": [
        "Sections without data: brand_assets."
      ],
      "selection_note": "Study how object photography, small labels, and a regular grid work together.",
      "note_basis": "Editorial inference from TasteLabs extraction; not visually verified.",
      "paths": {
        "profile": "profiles/teenage-engineering.md",
        "tokens": "data/tokens/teenage-engineering.json",
        "raw": "data/raw/teenage-engineering.json"
      }
    },
    {
      "id": "runway",
      "name": "Runway",
      "rank": 6,
      "source_url": "https://runwayml.com/",
      "captured_at": "2026-10-14T05:06:35.508514Z",
      "page_type": "Homepage",
      "use_cases": [
        "creative-tools"
      ],
      "styles": [
        "cinematic",
        "image-led"
      ],
      "quality": "extracted_unverified",
      "warnings": [],
      "selection_note": "Use large video demonstrations to explain what a creative tool produces.",
      "note_basis": "Editorial inference from TasteLabs extraction; not visually verified.",
      "paths": {
        "profile": "profiles/runway.md",
        "tokens": "data/tokens/runway.json",
        "raw": "data/raw/runway.json"
      }
    },
    {
      "id": "figma",
      "name": "Figma",
      "rank": 7,
      "source_url": "https://www.figma.com/",
      "captured_at": "2026-09-15T16:36:48.597923Z",
      "page_type": "Homepage",
      "use_cases": [
        "creative-tools"
      ],
      "styles": [
        "color-accent",
        "modular"
      ],
      "quality": "extracted_unverified",
      "warnings": [
        "Sections without data: brand_assets."
      ],
      "selection_note": "Separate interface elements from work samples through blocks and color accents.",
      "note_basis": "Editorial inference from TasteLabs extraction; not visually verified.",
      "paths": {
        "profile": "profiles/figma.md",
        "tokens": "data/tokens/figma.json",
        "raw": "data/raw/figma.json"
      }
    },
    {
      "id": "fal",
      "name": "fal",
      "rank": 8,
      "source_url": "https://fal.ai/",
      "captured_at": "2026-08-28T19:12:29.386999Z",
      "page_type": "Homepage",
      "use_cases": [
        "developer-tools",
        "creative-tools"
      ],
      "styles": [
        "color-accent",
        "modular"
      ],
      "quality": "extracted_unverified",
      "warnings": [
        "Sections without data: brand_assets."
      ],
      "selection_note": "Present creative infrastructure through technical blocks with prominent color accents.",
      "note_basis": "Editorial inference from TasteLabs extraction; not visually verified.",
      "paths": {
        "profile": "profiles/fal.md",
        "tokens": "data/tokens/fal.json",
        "raw": "data/raw/fal.json"
      }
    },
    {
      "id": "elevenlabs",
      "name": "ElevenLabs",
      "rank": 9,
      "source_url": "https://elevenlabs.io/",
      "captured_at": "2026-09-25T02:38:41.527311Z",
      "page_type": "Homepage",
      "use_cases": [
        "creative-tools",
        "editorial-research"
      ],
      "styles": [
        "warm-editorial",
        "modular"
      ],
      "quality": "extracted_unverified",
      "warnings": [
        "Sections without data: brand_assets."
      ],
      "selection_note": "Study cream backgrounds, rounded controls, and subtle layers for audio tools.",
      "note_basis": "Editorial inference from TasteLabs extraction; not visually verified.",
      "paths": {
        "profile": "profiles/elevenlabs.md",
        "tokens": "data/tokens/elevenlabs.json",
        "raw": "data/raw/elevenlabs.json"
      }
    },
    {
      "id": "anthropic",
      "name": "Anthropic",
      "rank": 10,
      "source_url": "https://www.anthropic.com/",
      "captured_at": "2026-09-15T16:01:07.284282Z",
      "page_type": "Homepage",
      "use_cases": [
        "editorial-research"
      ],
      "styles": [
        "warm-editorial"
      ],
      "quality": "extracted_unverified",
      "warnings": [
        "Sections without data: brand_assets."
      ],
      "selection_note": "Give research content hierarchy through warm light backgrounds and serif/sans contrast.",
      "note_basis": "Editorial inference from TasteLabs extraction; not visually verified.",
      "paths": {
        "profile": "profiles/anthropic.md",
        "tokens": "data/tokens/anthropic.json",
        "raw": "data/raw/anthropic.json"
      }
    },
    {
      "id": "nothing",
      "name": "Nothing",
      "rank": 11,
      "source_url": "https://nothing.tech/",
      "captured_at": "2026-09-19T06:36:19.660967Z",
      "page_type": "Homepage",
      "use_cases": [
        "hardware"
      ],
      "styles": [
        "monochrome",
        "modular"
      ],
      "quality": "extracted_unverified",
      "warnings": [
        "Sections without data: brand_assets."
      ],
      "selection_note": "Connect device presentation with dot typography and an industrial structure.",
      "note_basis": "Editorial inference from TasteLabs extraction; not visually verified.",
      "paths": {
        "profile": "profiles/nothing.md",
        "tokens": "data/tokens/nothing.json",
        "raw": "data/raw/nothing.json"
      }
    },
    {
      "id": "midjourney",
      "name": "Midjourney",
      "rank": 12,
      "source_url": "https://www.midjourney.com/",
      "captured_at": "2026-10-14T05:05:44.432260Z",
      "page_type": "Homepage",
      "use_cases": [
        "creative-tools"
      ],
      "styles": [
        "dark-technical",
        "cinematic"
      ],
      "quality": "extracted_unverified",
      "warnings": [],
      "selection_note": "Explore a dark presentation with monospace type and images as evidence of creative capability.",
      "note_basis": "Editorial inference from TasteLabs extraction; not visually verified.",
      "paths": {
        "profile": "profiles/midjourney.md",
        "tokens": "data/tokens/midjourney.json",
        "raw": "data/raw/midjourney.json"
      }
    },
    {
      "id": "stripe",
      "name": "Stripe",
      "rank": 13,
      "source_url": "https://stripe.com/",
      "captured_at": "2026-09-18T13:26:14.774070Z",
      "page_type": "Homepage",
      "use_cases": [
        "fintech",
        "developer-tools"
      ],
      "styles": [